id,en,pt
BOOK_HINT_LADDERCOMP_REVISED,"Press Z to attach Companion to ladder, then use commands to direct them
Z also makes the Companion quit the ladders.
The Companion starts off idle when entering/exiting ladders.
Try having the Companion on the ladder side-by-side with you, if you feel like it!
Then use commands and move vertically.
When they reach a ladder's top/bottom and leave, they retain
equivalent states of following/running.","Prime Z para meter o/(a) Companheiro(a) nas escadas e depois use ordens para direcioná-lo(a)
Z também faz o(a) Companheiro(a) sair das escadas.
O/(a) Companheiro(a) começa parado(a) quando entra nas/sai das escadas.
Tenta ter o/a Companheiro(a) na escada lado-a-lado contigo, se quiseres!
Depois, usa comandos e move verticalmente.
Quando eles alcançam o topo/fundo das escada e saem, Companheiros
mantêm estados equivalentes de seguir/correr."
FAYGO_NPC_TALK_NOITEM,I'll promise to show you a cool magic trick if you find my balloons.,Eu prometo mostrar um truque de magia fixe se tu encontrares os meus balões.
FAYGO_NPC_TALK_YESITEM,"Awesome, see? Pretty cool, huh?
Seems the clowns that live here don't have any cool powers like this.
Quite a shame, I must say.","Fixe, não é? Estás a ver?
Parece que os palhaços daqui não têm poderes fixes como este.
Mas que tristeza, não é?"
FAYGO_NPC_HUG,I don't like getting hugs from strangers but sure.,Não gosto de ser abraçada por estranhos mas está bem.
FAYGO_NPC_HURT,Your puny butter knife can't hurt me.,Essa tua faca de manteiga patética não me magoa.
FAYGO_NPC_HONK,"Don't you dare even touch my nose, weirdo.","Nem te atreves tocar no meu nariz, esquisita."
SAMATHA_NPC_TALK,"Here at Obnizirovat Inc, we make sure that robots are as good as citizens as they are as servants!
As long as a robot behaves, it deserves the same rights as any human and will ever need to be recycled!
Make sure to stay vigilante over any time a robot misbehaves!","Aqui na Obnizirovat Inc, garantimos que os robôs sejam excelentes como cidadãos quanto como servos!
Enquanto um robô age corretamente, merece os mesmos direitos que qualquer ser humano e não precisará de ser reciclado!
Fique atento a qualquer mau comportamento de qualquer robô!"
GANYAH_NPC_TALK,"Don't mind a stranger like me. I like coming to places, regardless of how it affects others.
You must be having a good time with friends.
Would be a shame if it turns out the future brings unpleasent surprises to affect all.
But I love surprises, even if others don't.","Não te preocupes comigo. Eu gosto de ir a lugares, apesar de como afeto os outros.
Deves estar a ter um bom momento com amigos.
Seria terrível se o futuro acaba por trazer surpresas horríveis que podem afetar todos.
Mas eu gosto de surpresas, mesmo que os outros as odeiam."
ANNAFRESSER_NPC_TALK_PRESWITCH,"Man, the water here is amazing.
Feels good to take a break away from chewing off demons.","Meu, a agua aqui é maravilhosa.
É tão bom descansar um pouco, vindo de morder demónios."
ANNAFRESSER_NPC_TALK_POSTSWITCH,"Hey, ya blew it!
Oh well, back to work I guess.","Hey, arruinaste o momento!
Enfim, de volta ao trabalho talvez."
XEMAROKK_NPC_TALK_LEGS,"This place is weak, puny, embarrassing.
None of these creatures mean even a fraction of a challenge.
And you kids dare to even come close to me?
I admire stupidity like that, must I admit.","Este sitio é patético, nojento e embaraçoso.
Nenhuma destas criaturas representa nem uma fração de desafio.
E vocês, miúdos, se atrevem a chegar perto de mim?
Admiro estupidez como essa, devo admitir."
XEMAROKK_NPC_TALK_HEAD,"Uh, maybe you're not as dumb as you look.","Uh, talvez vocês não são tão estúpidos como parecem."
CLARITY_NPC_TALK,"That's my room.
If you wanna talk, you're always welcome.","Ali é o meu quarto.
Se quiseres falar, és sempre bem vinda."
CLARITY_NPC_HURT,"Hey, don't break the screen.
If I see one scratch, you're going to pay for it.","Hey, não partes o ecrâ.
Se eu vir um arranhão, vais ter que pagar."
CLARITY_NPC_HUG,I'd love to hug you back but I fear it could be uncomfortable for you.,Gostava de te abraçar de volta mas tenho medo que pode ser desconfortável para ti.
CLARITY_NPC_HONK,I... didn't know I had any programming to feel this.,Eu... não sabia que tinha qualquer programação para sentir isto.
GREK_MERC_SOLDER_NAME,Grek Force Mercenary,Mercenário da força Grek
GREK_MERC_TALK_1,"Better watch out, the ammo dispenser bots were hacked!
This could be sign of an incoming attack.","É melhor teres cuidado!
As dispensas robô de munição foram manipuladas! 
Isto poderá ser sinal de um ataque iminente."
BOLT_NPC_TALK,"If you get your clothes dirty, I can help you with that.
Cleaning is my speciality.","Se você sujar a roupa, posso lhe ajudar com isso.
A limpeza é a minha especialidade."
BOLT_NPC_HUG,Can I play with your brother?,Posso brincar com o seu irmão?
BOLT_NPC_HURT,"Why are you being hostile all of a sudden?
Did you get any radiation?","Porque é que você está a ser agressiva de repente?
Apanhou alguma radiação?"
ISAAC_NPC_TALK,"At least this portal still works.
This one will take you to the city.","Pelo menos este portal ainda funciona.
Este portal vai levar-vos para a cidade."
ISAAC_NPC_HONK,"Meh, you're not my type.
I still have that cleaning girl from the grid in my mind.","Meh, não és do meu tipo.
Ainda tenho aquela rapariga que limpa na grelha, na minha cabeça."
ISAAC_NPC_HUG,I never thought any girl could be interested in a guy like me.,Nunca pensei que qualquer rapariga se poderia interessar num tipo como eu.
ISAAC_NPC_HURT,"Put that thing down!
You're in the base of the toughest guys on Earth!
They could kill you and bury your remains in a briefcase.","Abaixa essa coisa!
Estás na base dos homens mais fortes à face da Terra!
Eles podem te matar e enterrar os teus restos numa mala."
GREK_MERC_FORCE_LORE,"Current year: 2219.
As years passed, the Greklovick Mercenary Force grew to the point it could rival some 
establishments of the government such as the official police force and the army.
Founded by Qubritz, the Merc force still remains an independent organization giving job 
opportunities to any man with any knowledge or experience on combat and weapon usage.","Ano atual: 2219.
Enquanto anos passaram, a força mercenária de Greklovick cresceu ao ponto de competir com 
estabelecimentos do governo como a força da policia e o exercito.
Fundada pelo Qubritz, a força Merc ainda continua como uma organização independente, a dar 
oportunidades de trabalho para qualquer homem com conhecimento ou experiência de combate e uso de armas."
YIEGOUR_NPC_TALK,"The future is rough but we still manage to find ourselves a way or two to live.
At least for now.","O futuro é duro mas ainda conseguimos arranjar uma ou duas maneiras de viver.
Pelo menos até agora."
YIEGOUR_NPC_HONK,"Is it the armor you like?
It's the Nexus type 2.3, latest model so far.
...at least I hope that's the case.","Será que é a armadura que te interessa?
É do tipo Nexus 2.3, do ultimo modelo.
...pelo menos espero que é o caso."
YIEGOUR_NPC_HURT,"I could do worse than that when I was your age.
In fact, it's part of why they recruited me.","Eu poderia fazer pior que isso quando tinha a tua idade.
Alias, é parte da razão pela qual eles me recrutaram."
YIEGOUR_NPC_HUG,"Something's wrong?
If it's family issues, you can talk to me about that.","Algo de errado?
Se for problemas de família, podes falar comigo sobre isso."
GREK_MERC_SOLDIER_NAME_1,Grek Mercenary 1,Mercenário Grek 1
GREK_MERC_SOLDIER_NAME_2,Grek Mercenary 2,Mercenário Grek 2
GREK_TWO_MERCS_CONVO_1,"It seems they're putting general Simo's consciousness in a combat robot.
Some big green machine with his medals and hat attached.","Parece que vão meter a consciência de general Simo num robô de combate.
Uma grande maquina verde com as suas medalhas e o seu chapéu."
GREK_TWO_MERCS_CONVO_2,"He was one of half the population that actually had a brain chip, right?
I recall that being the key to how a robot can be as intelligent as any human.","Ele era da metade da população que tinha um chip no cérebro, certo?
Lembro disso ser chave para um robô ser tão inteligente como qualquer humano."
GREK_TWO_MERCS_CONVO_3,"Knowing his age, he obviously didn't get that at birth.
But unlike most robots, this one is allowed to keep his memories.
At least since his brain chip cirurgy.","Sabendo a idade, ele obviamente não teve o chip desde nascimento.
Mas ao contrário de outros robôs, ele tem o direito de manter as suas memorias.
Pelo menos desde da cirurgia do chip cerebral."
GREK_TWO_MERCS_CONVO_4,I often wonder what would happen if a low level robot suddenly regained memories from its borrowed brain.,"Ás vezes penso no que pode acontecer se um robõ de nível baixo de repente volta a ter memorias
do seu cérebro emprestado."
CONVO_YIEGOUR_CLARITY_1,"Yiegour, do you still participate in that beekeeper hobby?","Yiegour, ainda participas nesse passatempo da apicultura?"
CONVO_YIEGOUR_CLARITY_2,"It's always been more than a hobby.
Lately, Isaac and I have been thinking on weaponizing some honey.","Era sempre mais que um passatempo.
Ultimamente, eu e o Isaac pensamos em armar algum mel."
CONVO_YIEGOUR_CLARITY_3,"I know pure honey is flammable.
Will you use it along with your gun's fire mode?","Eu sei que o mel puro é inflamável.
Vais combinar o mel com o modo de fogo da tua arma?"
CONVO_YIEGOUR_CLARITY_4,"We were thinking on using it to immobalize a target.
Getting someone stuck in sticky honey without killing or perhabs injuring them that much.","Nós estivemos a pensar em usar mel para imobilizar um alvo.
Meter alguém preso em mel viscoso sem ter de lhe matar ou até ferir gravemente."
FRAGILE_NPC_TALK,"Hello, did they throw you out to the trash as well?
Nobody wants to even recycle me.","Olá, alguém te deitou fora para o lixo também?
Ninguém quer até me reciclar."
FRAGILE_NPC_HUG,"That's all I ever nee-ee-e-ee-ee-ded.
A hu-.... ggg.","Era isso que eu pr-pr-pre-cisava.
Um abr-.... aço."
FRAGILE_NPC_HURT,WHY DOES NO ONE WANT TO BE MY FRIE-E-E-E-E-E-E-NDDDD!?,PORQUE É QUE NINGUÉM QUER SER MEU AMI-G-G-G-G-GOOOO!?
RAYMOND_NPC_TALK,"Only a few more years and I'm disposable.
Death or mutation, my fate is sealed.
If only it came much sooner.","Só mais alguns anos e sou descartável.
Morte ou mutação, o meu destino está escrito.
Se ao menos chegasse muito mais cedo."
RAYMOND_NPC_HURT,"I shot civilians much younger than you.
Wanna make me a criminal before I turn into ashes?","Eu disparei a civis muito mais jovens que tu.
Queres me tornar um criminoso antes que eu acabo em cinzas?"
RAYMOND_NPC_HUG,"Don't pity someone as artificial as me.
Even a robot has more genuine emotions.","Não tenhas pena de alguém artificial como eu.
Até um robô tem emoções mais autênticas."
RAYMOND_NPC_HONK,"The youth have such a terrible sense of humor.
Maybe I'm glad I was never one of you.","A juventude tem um senso de humor terrível.
Talvez é melhor que eu nunca fui um de vocês."
GREK_POLICE_NAME,Greklovick Police,Policia de Greklovick
GREK_POLICE_TALK,"Better watch it, kid!
You go to that wasteland, you better not come back unless you get cleaned hard.
If we detect heavy mutation, your sentence is death.","É melhor teres cuidado, miúda!
Se vais para aquela terra morta, é melhor não voltares até receberes uma limpeza total.
Se detetarmos alguma grande mutação, a tua sentença é a morte."
LAHRN_NPC_TALK,"If you love someone, you protect them, no matter the cost.
But we all learn this the hard way.
After all... this isn't even my heart.","Se amas alguém, tu proteges essa pessoa, seja qual for o preço.
Mas nós todos aprendemos isso da maneira mais difícil.
Aliás.. isto nem sequer é o meu coração."
LAHRN_NPC_HURT,That's an embarrassing blade you got there.,Que lamina embaraçosa que tens ai.
LAHRN_NPC_HONK,"Is your brain fried because of the chip or what?
...you're not from here, are you?","O teu cérebro está frito por causa do chip ou o quê?
...não és daqui, certo?"
LAHRN_NPC_HUG,"You don't have to be afraid.
Just don't get with the wrong people.","Não precisas de ter medo.
Tenta só não te meter com as pessoas erradas."
GREK_THE_GRID_BUILDING_LORE,"The grid is the largest megastructure of Greklovick.
Considered to be a country on its own, the building is large enough
to cover the sun to most other buildings and establishments in the main city.
But to most people, this is considered a positive.
Our current climate situation reached a point where bases on the moon had
to grow vegetation just to produce oxygen and import it back to Earth.","A grelha é a maior mega-estrutura em Greklovick.
Considerada um pais em si própria, o edifício é grande suficiente
para tapar o sol para a maioria dos edifícios e estabelecimentos na cidade principal.
Mas para muitas pessoas, isto é considerado um beneficio.
A nossa situação atual do clima chegou ao ponto em que bases na Lua tiveram
de crescer vegetação para produzir oxigénio e transporta-lo de volta á Terra."
KLER_NPC_TALK,"Rodchenkot was once a great city, unlike Greklovick.
But nobody knew about that secret lab.
All it took was an accident there and the rest is history.","Rodchenkot dantes era uma linda cidade, ao contrario de Greklovick.
Mas ninguém sabia daquele laboratório secreto.
De repente, aconteceu lá um acidente e o resto é historia."
KLER_NPC_HUG,"You seem nice.
But you're in the wrong place to look for a friend.","Pareces simpático.
Mas estás no sítio errado para procurar amigos."
KLER_NPC_HONK,"Feeling cold?
Looking for food? Money?
What do you want, kid?","Tens frio?
À procura de comida? Dinheiro?
O que tu queres, rapaz?"
KLER_NPC_HURT,"Don't bother, kid.
Instead of me, you should be afraid of the Scalpers.
Heard a guy lost his face from one of them.
But others lost much more.","Não vale a pena, miúdo.
Em vez de mim, devias ter medo dos Escalpeladores.
Ouvi falar dum tipo que perdeu a cara por causa de um deles.
Mas outros perderam muito mais."
GREK_RAD_CREW_TALK,"You better find some suit if you're thinking of a short visit outside.
And don't bring children there either.","É melhor encontrares um fato se estás a pensar numa visita curta lá fora.
E não podes trazer crianças para lá também."
GREK_RAD_CREW_NAME,Grek radiation specialist,Especialista de radiação Grek
GREK_MEDIC_CREW_TALK,"These species could be in a similar level of intelligence as humans, despite their odd anatomy:
5 eyes, 2 mouths, purple blood, 7 fingers, antennas, an odd tail and unusual materials for clothing.
We've also seen strange objects believed to be weapons.","Estas espécies podem estar num nível de inteligência semelhante ao dos humanos, apesar da sua anatomia estranha:
5 olhos, 2 bocas, sangue roxo, 7 dedos, antenas, cauda estranha e materiais invulgares para a roupas.
Também vimos objetos estranhos que podem ser armas de combate."
GREK_MEDIC_CREW_NAME,Grek medic,Médico Grek
GREK_VENUS_BASE_LORE,"Oddly enough, a large chunk of rock believed to come from planet Venus
was discovered floating aimlessly in space.
Grek's science division and government agreed on taking advantage of the large
piece of debris by building a series of structures.
Some of these are used for scientific research.
But what happened to planet Venus remains unknown to this day.","Curiosamente, um grande pedaço de rocha que se acredita vir do planeta Vénus 
foi descoberto a flutuar erraticamente no espaço.
A divisão científica e o governo de Grek concordaram em aproveitar do grande
pedaço de detrito, construindo uma série de estruturas.
Algumas delas são usadas para pesquisas científicas.
Mas o que aconteceu ao planeta de Vénus permanece desconhecido até hoje"
GREK_MERC_TALK_ABOUT_KLER,"Don't worry about Kler.
His team was sent to die by the main Grek army and his height was affected by radiation.
But I heard he managed to figure things out and make himself feel at home here.
They say he's got an ""elephant's foot"", whatever the Hell that means.","Não te preocupes com o Kler.
A equipa dele foi enviada para morrer pelo exército principal de Grek e a sua altura foi afetada pela radiação.
Mas ouvi dizer que ele conseguiu resolver as coisas e se sentir em casa aqui.
Dizem que ele tem um ""pé de elefante"", que raio que isso quer dizer."
CUTSCENE_11_TALK_1,"Go Mel! Go Mel! Go Mel!
Woooooow!","Vai Mel! Vai Mel! Vai Mel!
Woooooow!"
CUTSCENE_11_TALK_2,Maybe it's because we haven't seen any soccer action in years but you did good.,"Talvez é por não termos nenhum evento de futebol em anos, mas fizeste um bom trabalho."
CUTSCENE_11_TALK_3,"Well, Mel, you did enough to show off your kicks. Can we go home now?","Já mostraste os teus chutes, Mel. Podemos ir embora?"
CUTSCENE_11_TALK_4,"Alright, carrot. Let me just say good bye first.","Está bem, cenoura. Deixa só primeiro dizer adeus."
CUTSCENE_11_TALK_5,Holmes? Where the Hell were ya?,Holmes? Donde é que tivestes?
CUTSCENE_11_TALK_6,"Oh hey, McSher, looking for another bottle of whiskey?","Oh hey, McSher, á procura doutra garrafa de whiskey?"
CUTSCENE_11_TALK_7,"No, you idiot! I need to tell you something. It's about Marlon.","Não, ó parvo! Tenho algo para te dizer. é sobre o Marlon."
CUTSCENE_11_TALK_8,Marlon Valentinou? What has he been up to?,Marlon Valentinou? O que é que ele anda a tramar?
CUTSCENE_11_TALK_9,Heard he was looking for some artifacts. Something to do with the god Mluto.,Ouvi falar que ele anda á procura duns artefactos. Algo relacionado com o deus Mluto.
CUTSCENE_11_TALK_10,Has he gone mad?,Será que ele enloqueceu?
CUTSCENE_11_TALK_11,"I know exactly what he's looking for.
And I think I know who could also be involved.","Eu sei exatamente do que ele anda á procura.
E acredito que sei também quem mais pode estar neste assunto."
CUTSCENE_11_TALK_12,What is this place?,Que lugar é este?
CUTSCENE_11_TALK_13,"It's a beach, almost like any other. I come here by sometimes.
Sometimes, this place doesn't seem that bad. There are famliar things in this world.","É uma praia, como qualquer outra. Ás vezes, venho para este lugar.
Em algumas ocasiões, este lugar não parece assim tão mal. Há coisas familiares neste mundo."
CUTSCENE_11_TALK_14,"Maybe we could try and have some time to keep our minds at ease, while nothing happens.
After all, your grandmother could be close to getting us back.","Talvez podemos aproveitar uns momentos para acalmar enquanto nada acontece.
Alem disso, a tua avó pode estar perto de nos salvar."
CUTSCENE_11_TALK_15,"Sure. Maybe a break here can't be that bad.
There's even that abandoned store with beach clothes and stuff.","Sim. Talvez uma pausa aqui pode ser bom.
Temos até aquela loja abandonada com fatos de banho e outras coisas."
CUTSCENE_12_TALK_1,"So, what have you guys been up to?","Então, como é que vocês andam?"
CUTSCENE_12_TALK_2,"We've wanted to show you a friend we've made in a while.
Her name's Amalia.","Nós queríamos vos mostrar uma amiga que fizemos em algum tempo.
Ela se chama Amália."
CUTSCENE_12_TALK_3,What is that? Is that a house?,"O que é aquilo, uma casa?"
CUTSCENE_12_TALK_4,And it's alive.,E está viva.
CUTSCENE_12_TALK_5,HELP!!!,SOCORRO!!!
CUTSCENE_12_TALK_6,STELLA! WE GOTTA SAVE HER!,STELLA! TEMOS QUE SALVÁ-LA!
CUTSCENE_13_TALK_1,"What happened?
STELLA?","O que aconteceu?
STELLA?"
CUTSCENE_13_TALK_2,"That monster is no more, but Stella is severely injured.
I had to transform just to make sure that house stays dead.","Aquele monstro já mais não é, mas a Stella tem feridas graves.
Tive que transformar para ter a certeza que aquela casa fica morta."
CUTSCENE_13_TALK_3,"Stella, are you okay?","Stella, estás bem?"
CUTSCENE_13_TALK_4,"I'll take care of her. With enough time, her injuries will heal.","Eu vou tratar dela. Com tempo suficiente, as feridas serão curadas."
CUTSCENE_13_TALK_5,"WHAT IS WRONG WITH YOU GUYS?
SHE COULD'VE BEEN KILLED!","O QUE É QUE SE PASSOU COM VOCÊS?
ELA PODIA MORRER!"
CUTSCENE_13_TALK_6,"WHAT COULD'VE WE DONE?
NONE OF THIS WAS OUR FAULT!","O QUE PODÍAMOS NÓS FAZER?
ISTO NÃO É DA NOSSA CULPA."
CUTSCENE_13_TALK_7,Maybe your friend was the one that started it.,Talvez foi a tua amiga que começou.
CUTSCENE_13_TALK_8,Amalia was calm and now she's gone because of you.,"A Amália era calma, mas agora foi abaixo por causa vossa."
CUTSCENE_13_TALK_9,"I know what it is.
We've been here longer than your group, so you don't really understand how things work here.","Já sei o que é.
Nós estivemos aqui por muito tempo antes da vossa chegada, por isso, nenhum de vocês entende como funcionam as coisas aqui."
CUTSCENE_13_TALK_10,I'm better now. I didn't know those guys were different versions of you.,Já estou melhor. Não sabia que aqueles miúdos eram versões diferentes de vocês.
CUTSCENE_13_TALK_11,"And we're probably not gonna see them again.
This place might've rotted their minds.","E já não devemos voltar a vê-los.
Este sitio provavelmente arruinou-lhes as mentes."
CUTSCENE_13_TALK_12,"Mel, should we continue exploring new places?","Mel, vale a pena continuar a explorar novos lugares?"
CUTSCENE_13_TALK_13,"I'm detecting something. A portal but it's not from my device!
Huh? It's just a couple of kids...","Estou a detetar algo. Um portal mas não vem do meu dispositivo!
Huh? É só uma cambada de miúdos..."
CUTSCENE_13_TALK_14,What place is this? The air feels so...,Que lugar é este? O ar parece tão...
CUTSCENE_13_TALK_15,"HOLD STILL, I MUST DO A QUICK ANALYSIS....","NÃO SE MEXAM, VÃO TER QUE SER ANALISADOS...."
CUTSCENE_13_TALK_16,"No radiation or malicious entity found.
Sorry about that. My name's Clarity and this is the Greklovick Mercenary Base.
The year is 2219.","Nenhuma radiação ou entidade maliciosa encontrada.
Desculpem lá. Chamo-me Clarity e isto é a Base Mercenária de Greklovick.
O ano é 2219."
CUTSCENE_13_TALK_17,What kind of place is this?,Que tipo de lugar é este?
CUTSCENE_13_TALK_18,"Here at the Grek base, we do all sorts of well armed works. Hence we rival even the main Grek army and police forces.
Name's Yiegour Sarvotsky, but some friends call me ""B-Man"".","Aqui na base Grek, fazemos qualquer tipo de trabalho armado. Por isso rivalizamos até o exercito principal e as forças policiais.
O nome é Yiegour Sarvotsky, mas alguns amigos chamam-me ""B-Man""."
CUTSCENE_13_TALK_19,"Feel free to explore this place but do be carefull.
Lot of things around here are designed to kill and some security systems are activated.","Podem explorar este sitio como quiserem mas têm cuidado.
Muitas coisas aqui foram feitas para matar e alguns sistemas de segurança estão ativos."
CUTSCENE_14_TALK_1,"Wow, those ships look cool.
This reminds me of when the 2 of us wanted to be astronauts.","Wow, estas naves são tão fixes.
Lembram-me de quando nós os 2 queriam ser astronautas."
CUTSCENE_14_TALK_2,"Oscar, Pete. Both of you, get out of there now!","Oscar, Pete. Vocês os dois, saem dai já!"
CUTSCENE_14_TALK_3,"We're just looking at this stuff. 
We're not gonna touch anything.","Só estávamos a ver.
Não vamos tocar em nada."
CUTSCENE_14_NAME_BASE_ANNOUNCER,Base announcer,Anunciador da Base
CUTSCENE_14_TALK_4,Attention. The base is at state of emergency! Please proceed to the nearest escape ship!,"Atenção. A base está em estado de emergência! Por favor, prossiga para a nave de fuga mais próxima!"
CUTSCENE_14_TALK_5,What's going on?,O que se passa?
CUTSCENE_14_TALK_6,"I don't know, but we might as well enter one of these ships.",Não sei mas é melhor entrar numa destas naves.
CUTSCENE_14_TALK_7,"But wait, we don't even know how they work.","Espera lá, nem sequer sabemos como elas funcionam."
CUTSCENE_14_NAME_EVERYONE,Everyone,Todos
CUTSCENE_14_TALK_8,Ouch. Is everyone okay?,Ouch. Estão todos bem?
CUTSCENE_14_TALK_9,"What the Hell happened? And how did you get that vehicle? Did you get any permission?
Where's your identification?","Que raio aconteceu aqui? Donde arranjaram esse veiculo? Tiveram alguma permissão?
Onde estão as vossas identificações?"
CUTSCENE_14_TALK_10,"We don't have any.
We were visiting a lab from space and something happened, so we had to use this ship.","Não temos nenhuma.
Visitamos um laboratório no espaço e algo aconteceu, por isso tivemos que usar esta nave."
CUTSCENE_14_TALK_11,"So you don't have any form of identification nor authorization to use this ship.
Then come with me quick before I-","Então não têm nenhuma identificação ou autorização para aquela nave?
Vêm comigo antes que eu-"
CUTSCENE_14_TALK_12,"Let them go, Soromovikz!
They're with me.","Deixa-lhes em paz, Soromovikz!
Eles estão comigo."
CUTSCENE_14_TALK_13,"Yiegour? Mh, sure.
Better make sure to pay for the damage, since you ""mercs"" are paid more for doing half of what we do.","Yiegour? Mh, está bem.
É melhor pagares pelo dano, já que vocês ""mercs"" recebem mais por fazer metade do nosso trabalho."
CUTSCENE_14_TALK_14,Are you mad at us for going too far?,Está zangado connosco por irmos assim tão longe?
CUTSCENE_14_TALK_15,"I'm rather impressed. Somehow you're still alive. 
But I'm gonna put you all in a safer place and not as a punishment. 
They said we could be dealing with an attacker at some point, so I wanna make sure you kids stay out of that.","Eu estou é impressionado. Apesar de tudo, estão vivos.
Mas terei que meter-vos num lugar mais seguro e não como castigo.
Dizem que podemos antecipar um ataque a qualquer momento, então tenho que ter a certeza que não estejam envolvidos."
CUTSCENE_14_TALK_16,And what's in your mind?,E o que estas a pensar?
