id,en,pt
CUTSCENE_6_TALK_22,"Don't worry, Booker.
We can handle this situation.","Não te preocupes, Booker.
Nós podemos lidar com esta situação."
,,
STELLA_NPC_TALK,"I'm glad to soon be back home, though I'm gonna miss Booker.","Ainda bem que posso voltar para casa, mesmo se vou ter saudades do Booker."
STELLA_NPC_HURT,"Hey, watch out!
I thought we were friends.","Hey, cuidado!
Pensava que éramos amigas."
STELLA_NPC_HUG,"Aww, you're so sweet.","Aww, és tão querida."
STELLA_NPC_HONK,I'm not sure if Kat is okay with this...,Não sei que a Kat não se importa disto...
ZARINA_NPC_TALK,"That device seems to be unfinished.
The fact that you're all still alive is in a way, a miracle.","Esse instrumento deve ser incompleto.
Vocês todos ainda estarem vivos é, de certa forma, um milagre."
ZARINA_NPC_HURT,Why are you misbehaving?,Porque é que está a portar muito mal?
ZARINA_NPC_HUG,"You seem very lovely.
When we get through this, I could make some tea for you to try.","Você parece muito adorável.
Quando passar-mos por isto tudo, posso fazer um chá para você experimentar."
ZARINA_NPC_HONK,"Have some manners, please!","Tenha alguma educação, por favor!"
CONVO_TALK_STELLA_ZARINA_1,"I heard a town in Auliswaria was hit by a limnic eruption.
How many people were affected?","Ouvi dizer que uma cidade em Auliswaria foi atingida por uma erupção límnica.
Quantas pessoas foram afetadas?"
CONVO_TALK_STELLA_ZARINA_2,"I managed to heal some families and animal livestock.
But there's a chance it might in other places and I must return to do something about it.","Consegui curar algumas famílias e rebanhos.
Mas há uma hipótese de que isso acontecer em outros lugares e devo voltar para tratar do assunto."
CONVO_TALK_STELLA_ZARINA_3,But can't people move away from those areas?,Mas as pessoas não podem mudar para outros lugares?
CONVO_TALK_STELLA_ZARINA_4,"The towns were built long before everyone knew about the state of the lakes.
But I could figure out different solutions when an eruption happens.","As cidades foram construídas muito antes de todos saberem sobre o estado dos lagos.
Mas eu poderia descobrir soluções diferentes quando uma erupção acontecer."
SHIHIRO_NPC_TALK,"You will never have the same powers as I do, but I believe you don't need to.
Just master what you got and you can go further.
Be carefull, some of this stuff may hurt if you're not carefull.
But at least Zarina provided us with healing water
At least 7 destroyed targets is enough.","Vocês nunca vão ter os mesmos poderes que eu, mas acredito que não precisam.
Basta dominar o que têm e podem ir mais longe.
Tem cuidado porque algumas coisas podem te magoar se não tens cuidado.
Pelo menos a Zarina trouxe-nos agua curativa.
Pelo menos 7 alvos destruídos é suficiente."
SHIHIRO_NPC_HURT,This isn't how I wanted to see your combat skills.,Não é assim que eu queria ver as tuas habilidades de combate.
SHIHIRO_NPC_HUG,"Is something alright?
If you're feeling a bit down, you can always talk about it.","Está tudo bem?
Se estares a sentir um pouco deprimido, podes sempre falar sobre isso."
SHIHIRO_NPC_HONK,You too could have this physique if you exercise a bit more.,Poderias também ter esta forma se fizeres mais exercício.
BOOK_HINT_LADDERCOMP3,"Try having the Companion on the ladder side-by-side with you, if you feel like it!
Then use commands and move vertically.","Tenta ter o/a Companheiro(a) na escada lado-a-lado contigo, se quiseres!
Depois, usa comandos e move verticalmente."
BOOK_HINT_LADDERCOMP4,"When they reach a ladder's top/bottom and leave, they retain
equivalent states of following/running.","Quando eles alcançam o topo/fundo das escada e saem, Companheiros
mantêm estados equivalentes de seguir/correr."
NORTUBEL_LORE_CHEESE_T,"A popular annual event held at Porteijo involves a wheel of cheese being thrown from a hill,
while participants race down chasing the cheese wheel.
Often, most of these participants find themselves rolling along the cheese.
The cheese is often covered by a durable packaging, as a way to make sure it can still be
edible even after being used in an event like this.","Um evento anual popular realizado em Porteijo envolve uma roda de queijo sendo atirada duma colina,
enquanto os participantes correm atrás da roda do queijo.
Frequentemente, a maioria desses participantes se vêm rolando com o queijo.
O queijo é normalmente coberto por uma embalagem forte, para garantir que ainda pode ser
comestível mesmo depois de ser usado num evento como este."
NORTUBEL_LORE_FIRSTKING_T,"Nortubel is one of the oldest countries in the continent of Yunopa.
It was founded in 811 by its first king Lucidiere Alfredo.","Nortubel é um dos países mais antigos do continente de Yunopa.
Foi fundado em 811 pelo seu primeiro rei Lucidiere Alfredo."
NORTUBEL_LORE_POET_T,"Saramando Legoa was a poet born in 1880, in the region of Alentel.
He was notorious for various works in different categories.
Poetry, literature, philosophy, translation and political commentary.
Saramando Legoa's only son died at the age of 3, when he fell from a 3rd floor window.
Saramando Legoa's last years ended with depression and alcohol abuse.","Saramando Legoa foi um poeta nascido em 1880, na região do Alentel.
Ele ficou famoso por vários trabalhos em diferentes categorias.
Poesia, literatura, filosofia, tradução e comentário político.
O único filho de Saramando Legoa morreu aos 3 anos, quando caiu de uma janela do 2º andar.
Os últimos anos de Saramando Legoa terminaram com depressão e abuso de álcool."
MASSAG_LORE_CHICKEN_T,"A recent zoo incident lead to various Gallus roam around various cities.
Authorities and politicians advise citizens to stay at home during the time being.","Um recente incidente num jardim zoológico fez com que vários Gallus espalhacem
por várias cidades.
Autoridades e políticos aconselham cidadãos a ficarem em casa durante este período."
BARNEY_NPC_TALK,"This is my latest invention.
Don't mind if I test it out while we show you our world.","Isto é a minha ultima invenção.
Não se importe que eu a estreie enquanto nós mostramo-vos o nosso mundo."
BARNEY_NPC_HURT,Ah! Nooooo!,Ah! Nãaaaooo!
BARNEY_NPC_HUG,"Be carefull, this thing here is a prototype!","Cuidado, isto aqui é um prototipo!"
HOLMES_NPC_TALK,"Massag-Coav is a fantastic city, full of opportunities and dreams.","Massag-Coav é uma cidade fantástica, cheia de oportunidades e sonhos."
HOLMES_NPC_HURT,"You better have some manners around here, kid.","É melhor tu teres maneiras aqui, miúda."
HOLMES_NPC_HONK,"Well, this girl sure has claws, I can tell.","Bem, consigo dizer que esta rapariga tem garras."
HOLMES_NPC_HUG,"Hey, I don't even know you... but we could talk more if you want.","Hey, eu nem se quer te conheço... mas podemos falar mais se quiseres."
FERNAANDA_NPC_TALK,"This is the Diamond Friendly hotel, it's where I've met Feelix' father.
But I haven't seen him in years.","Este é o hotel ""Diamante Amigável"", onde conheci o pai do Feelix.
Mas eu não o tenho visto há anos."
FERNAANDA_NPC_HURT,"Watch out, this eletronic visor cost Barney a lot of money.
If I lose it, I'll be completely blind until someone can cure my condition.","Cuidado, este visor eletrónico custou ao Barney muito dinheiro.
Se eu o perder, eu ficarei completamente cega até alguém poder curar a minha condição"
FERNAANDA_NPC_HONK,"Hey, stop it!","Hey, pare com isso."
FERNAANDA_NPC_HUG,"You're a nice girl.
But be carefull with the apron.","Você é uma rapariga simpática.
Mas tem cuidado com o avental."
FEELIX_NPC_TALK,"When I grow up, I wanna be a pilot.","Quando eu crescer, quero ser um piloto."
FEELIX_NPC_HURT,"Don't break this plane, I made it myself and took a while!","Não estrague este avião, eu o fiz para mim próprio e demorei tempo!"
FEELIX_NPC_HUG,"Thank you.
I'm glad you didn't make fun of my eye.","Obrigado.
Estou feliz por você não fazer troça do meu olho."
KARLA_NPC_TALK,"Welcome to our sports center.
Is there any activity you would like to perform?","Bem vindos ao nosso centro de desporto.
Gostariam de juntar a alguma atividade desportiva?"
KARLA_NPC_HURT,"Who do you think I am?
I can burn you alive in self defense.","Quem é que você acha quem eu sou?
Eu posso queima-la viva por legítima defesa."
KARLA_NPC_HONK,"Hey, stop that or we'll ban you!","Hey, pare com isso ou será banida!"
KARLA_NPC_HUG,"Wow, thanks.
Are you a fan?","Wow, obrigada.
Será você uma fã?"
TOUNI_NPC_TALK,How many times do I gotta remind Dexter that the equipment stays here?,Quantas vezes tenho de dizer ao Dexter que o equipamento fica aqui?
TOUNI_NPC_HURT,"Hey, who are you and what's your problem?","Hey, quem é você e qual é o seu problema?"
TOUNI_NPC_HONK,"Can you stop?
I'm a married man.","Pode parar?
Sou um homem casado."
TOUNI_NPC_HUG,I used to be in better shape.,"Antigamente, eu estava em melhor forma."
KAROLINE_TALK_NOITEM,"Hey, have you seen an orange skateboard?
I was pretty sure it's here somewhere.","Hey, você viu uma prancha de skate em algum lado?
Tinha a certeza que estava por aqui."
KAROLINE_TALK_YESITEM,"Wow, thank you!
Next time, I should be more carefull.","Wow, obrigada!
Na próxima vez, devo ter mais cuidado."
KAROLINE_HUG,Why the hug? Did Feelix send you here?,Porquê o abraço? Foi o Feelix que te mandou?
KAROLINE_HURT,"Stop it, I'm gonna call my parents!","Para, vou chamar os meus pais!"
MCSHERRY_NPC_TALK,"I used to be a lifeguard that people could trust.
I wish that could come back....","Dantes, eu era uma guarda salva-vidas com a confiança de toda a gente.
Gostava que isso voltasse a acontecer..."
MCSHERRY_NPC_HURT,Don't start fights you cannot win.,Não comeces lutas que não podes ganhar.
MCSHERRY_NPC_HONK,"Hey, show some respect!","Hey, mostra algum respeito!"
MCSHERRY_NPC_HUG,"Awww, I'm glad you're not afraid of me.","Awww, estou feliz por não teres medo de mim."
JOOLIETTA_NPC_TALK,"Tomorrow, our students' grades will come out.
I don't have any hopes for my class.","Amanha, as notas dos nossos estudantes vão ser relevadas.
Eu não tenho esperança nenhuma para a minha turma."
JOOLIETTA_NPC_HUG,I guess this is all a hard working teacher like myself needs.,Talvez isso é a única coisa que uma professora trabalhadora como eu precisa.
JOOLIETTA_NPC_HONK,"Gaaargh, take your hands off me!","Gaaargh, tira as tuas mãos de mim!"
JOOLIETTA_NPC_HURT,What do you seek in hurting a school teacher like myself?,Em que procuras em magoar uma professora como eu?
ZARINA_AUDIENCE_WATER_T,"As long as you simply touch this magical water, you can heal your wounds.","Desde que você simplesmente toque nesta agua mágica, pode curar as suas feridas."
SMOOTH_CAMERA_OPTION_TEXT,     Smooth Camera on/off: C (Only works when game is unpaused),Camera suave (Des)ativa: C (Só funciona se o jogo não está pausado)
KANGAROO_ZACK_NPC_TALK,"Man, those Gallus even got to this city.
But at least I got enough stories of celebrities being injured, to make some quick cash out of.","Meu, estes Gallus até chegaram a esta cidade.
Pelo menus tenho estórias suficientes de celebridades serem atacadas, para fazer algum dinheiro."
STARFISH_JANITOR_NAME,Starfish Street Sweeper,"Varredor, estrela do mar"
STARFISH_JANITOR_TALK_NPC,The worst part of this Gallus invasion is all the mess I've gotta clean up.,A pior parte da invasão dos Gallus é a tralha que eu vou ter que limpar.
BOOK_HINT_CHAR_SWITCH_PLAY,"If you press ""O"", the little sibling becomes the player character.
Pressing ""P"" brings the playability back to the older sibling.","Se premires ""O"", os mais novos serão a personagem controlada.
Premir ""P"" traz o papel de jogabilidade de volta aos irmãos mais velhos."
KRIMB_WAREHOUSE_LORE_T,"Once owned by Caruso Inc, this once abandoned warehouse was used by the Capella family 
to continue their human trafficking business.
When Booker discovered the location and came to disrupt the business 
(Including saving the victims he could save and kill what remained of the family), 
he worked to change and restructure the warehouse into a personal base for his work and essentially, a home.","Antigamente propriedade da Caruso Inc, este armazém abandonado foi usado pela família Capella 
para continuar o seu negócio de tráfico humano.
Quando Booker descobriu o local e veio parar o negócio 
(Incluindo salvar as vítimas que podia salvar e matar o resto da família), 
ele trabalhou para mudar e reestruturar o armazém como uma base pessoal 
para o seu trabalho e essencialmente, uma casa."
MASSAG_LORE_CURRENTYEAR_T,"Current year: 2002
Massag-Coav (And similar places) is home to various species, although they come in 2 different categories.
The first category involves rational beings cable of speech, 
self awareness and creating anything from tools to culture.
Whereas beings in the second category are more limited in terms of cognitive abilities 
and are rather treated differently, from pets to resources.","Ano atual: 2002
Massag-Coav (E sítios parecidos) é casa de várias espécies, embora que cabem em 2 categorias diferentes.
A primeira categoria inclui seres capazes de falar, ter autoconsciência 
e criação de qualquer coisa, desde ferramentas até cultura.
Enquanto seres da segunda categoria são mais limitados em termos de capacidades cognitivas
e são tratados de formas diferentes, desde animais de estimação até fonte de recursos."
FERNAANDA_FEELIX_CONVO_TALK_1,"Mom, can I have ice cream?","Mãe, posso pedir um gelado?"
FERNAANDA_FEELIX_CONVO_TALK_2,"Of course you can, but it can't be chocolate.","Claro que podes, mas não pode ser de chocolate."
FERNAANDA_FEELIX_CONVO_TALK_3,But why? Everyone gets to eat chocolate but me.,Mas porquê? Todo a gente pode comer chocolate e eu não
FERNAANDA_FEELIX_CONVO_TALK_4,"You can't eat it because it's bad for you.
Even I can't eat it.","Não podes comer chocolate porque te faz mal.
Até eu não o posso comer."
HOLMES_BARNEY_CONVO_TALK_1,"Feels good to visit Atlantis, doesn't it?","Sabe bem visitar Atlantis, não sabe?"
HOLMES_BARNEY_CONVO_TALK_2,"Now I can't find Horatio.
I knew I shouldn't have brought him here.","Agora não consigo encontrar o Horatio.
Eu sabia que não o devia te-lo trazido aqui."
HOLMES_BARNEY_CONVO_TALK_3,"Relax, Barney.
I'm sure he'll return.","Tem calma, Barney.
Aposto que ele pode voltar."
HOLMES_BARNEY_CONVO_TALK_4,He might be familiar with this place at least.,Pelo menos ele pode ter alguma familiaridade com este lugar.
FEELIX_BARNEY_CONVO_TALK_1,"Hey look, it's miss Joolietta.","Olha, é a senhora Joolietta."
FEELIX_BARNEY_CONVO_TALK_2,Marie Joolietta... it's been a while.,Marie Joolietta... já foi a algum tempo.
FEELIX_BARNEY_CONVO_TALK_3,"You know her, mister Barney?","Você a conhece, senhor Barney?"
FEELIX_BARNEY_CONVO_TALK_4,"I used to date her, but things didn't end up well in the end.","Dantes namorei com ela, mas as coisas não correram assim tão bem no final."
HOLMES_FERNAANDA_CONVO_TALK_1,"Love the view here.
I can even see my bar from here.","Adoro a vista aqui.
Consigo até ver o meu bar daqui."
HOLMES_FERNAANDA_CONVO_TALK_2,I still get a bit creeped out from such a height.,Ainda tenho alguns arrepios com uma altura destas.
HOLMES_FERNAANDA_CONVO_TALK_3,"Relax, Fern.
Don't think too much about it.","Tem calma, Fern.
Não pensas demasiado nisso."
HOLMES_FERNAANDA_CONVO_TALK_4,"At least it's not raining, even if this city is usally above the clouds.","Pelo menos não está a chover, mesmo se esta cidade normalmente está em cima das nuvens."
BARNEY_FERNAANDA_CONVO_TALK_1,So... is Holmes trying to hit on you?,...O Holmes está a tentar lhe atrair?
BARNEY_FERNAANDA_CONVO_TALK_2,"Our relationship is still friendly at best.
Besides, I've heard stories about his past relationships with other women.","A nossa relação é amigável, na melhor das hipóteses.
Alem disso, ouvi falar de estórias sobre as suas relações antigas com outras mulheres."
BARNEY_FERNAANDA_CONVO_TALK_3,"Like the ice skater? I remember now.
He promised her he'd sabotage her rival before she ended up dumping him.","Como a patinadora de gelo? Agora me lembro.
Ele prometeu a ela que sabotaria uma rival dela antes de ela acabar com ele."
BARNEY_FERNAANDA_CONVO_TALK_4,Holmes goes too far over trying to please a woman.,Holmes chega demasiado longe para tentar agradar uma mulher.
FEELIX_HOLMES_CONVO_TALK_1,"Mister Holmes, how did you manage to pay for our tickets?","Senhor Holmes, como é que conseguiu pagar pelos nosso bilhetes?"
FEELIX_HOLMES_CONVO_TALK_2,"Half comes from the drinks and food, the other half from the casino room.","Metade vem de bebidas e comida, outra metade vem da sala de casino."
FEELIX_HOLMES_CONVO_TALK_3,"You're not doing anything that might be bad, are you?","Não está a fazer algo mau, certo?"
FEELIX_HOLMES_CONVO_TALK_4,"When you're old enough, I might teach you a few things my brother once taught me.
I can tell you that much.","Quando fores mais velho, talvez te ensino umas coisinhas que o meu irmão me ensinou.
É o que te posso dizer."
CONVO_HENSON_FAMILY_1,So nice of mister Dekarro to invite us for a trip.,Foi simpático do senhor Dekarro para nos convidar para uma viagem.
CONVO_HENSON_FAMILY_2,I wonder if the beaches are any good this time of the year.,Gostava de saber se as praias estão boas nesta era do ano.
CONVO_HENSON_FAMILY_3,"Aww, I could have brought the swimsuits...","Aww, podia ter trazido os fatos de banho."
CONVO_HENSON_FAMILY_4,I'm just more interested in the sand castle competition.,Eu só estou interessado no concurso de castelos de areia.
CONVO_HENSON_FAMILY_T_5,"Karoline, this must be the first time you've visited Elegantissia.","Karoline, isto deve ser a primeira vez que visitas Elegantissia."
CONVO_HENSON_FAMILY_T_6,"How is this place, dad?","Como é este sitio, pai?"
CONVO_HENSON_FAMILY_T_7,"There used to be a bar where I met a lot of golf players.
Golf was very popular here and there were only very few incidents of golf balls falling from this place.","Dantes havia um bar onde eu conheci muitos jogadores de golfe .
Golfe foi muito popular aqui e só houve poucas vezes em que algumas bolas caíram deste lugar."
CONVO_HENSON_FAMILY_T_8,I guess that explains the one time I saw a golf ball fall on someone's car.,Talvez isso explica aquela vez que vi uma bola de golfe cair num carro de alguém.
CONVO_CARRIE_KATRIN_BEACH_1,I like that there's even beaches in this weird place.,Eu gosto que até existem praias neste sitio estranho.
CONVO_CARRIE_KATRIN_BEACH_2,"For some reason, I felt something cold touched me when I was sleeping in the towel, with my stomach facing down.","Por alguma razão, senti que algo frio tocou-me quando estava a dormir na toalha, de barriga para baixo."
CONVO_CARRIE_KATRIN_BEACH_3,Must be some water droplets.,Devem ser gotas de agua.
CONVO_CARRIE_KATRIN_BEACH_4,"I bet there's gonna be a blue lipstick mark.
Well, if the water cleans it off...","Aposto que está ai uma marca de batom azul.
Pelo menos, se a água limpar isso..."
CONVO_OSCAR_PETE_BEACH_1,At least the sand here is nice.,Pelo menos a areia aqui é boa.
CONVO_OSCAR_PETE_BEACH_2,"Oscar, how come you and Carrie have a lot of freckles?
Is it because you 2 live near a beach?","Oscar, porque é que tu e a Carrie têm muitas sardas?
Será porque vocês vivem perto de uma praia?"
CONVO_OSCAR_PETE_BEACH_3,"I was told it might be from mom's side.
Even my aunt that lived in cold places still had them.","Disseram-me que pode ser do lado da minha mãe.
Até a minha tia que vivia em sítios frios tinha sardas."
CONVO_OSCAR_PETE_BEACH_4,I see.,Agora percebo.
CONVO_HENSON_FAMILY_T_9,"Wow, these trains have a lot of space!","Wow, estes comboios têm muito espaço!"
CONVO_HENSON_FAMILY_T_10,"Some of these are often used like hotels.
Some people even live here.","Alguns destes comboios são usados como hotéis.
Algumas pessoas até vivem aqui."
CONVO_HENSON_FAMILY_T_11,"Really? But why?
What if there's an accident?","A sério? Mas porquê?
E se houver um acidente?"
CONVO_HENSON_FAMILY_T_12,Maybe those people just do things for the sake of luxury.,Talvez essas pessoas só fazem coisas por causa do luxo.
MCSHERRY_NPC_TALK_2,"What does Holmes want from me this time?
Pretty sure there's more than just give these weird kids a tour.","O que é que o Holmes quer de mim desta vez?
Deve ser algo mais do que dar estes miúdos estranhos um passeio."
MCSHERRY_NPC_TALK_3,"Is Dr Barney still worried about Horatio?
Honestly, I'd let him free.","E o Dr Barney, ainda está preocupado com o Horatio?
Para ser honesta, eu o deixava livre."
JOOLIETTA_NPC_TALK_2,"Of course I wasn't invited. I came by myself!
I just want to see what Barney and the others are up to.","É claro que não fui convidada. Eu vim sozinha!
Só queria saber o que o Barney e os outros estão a fazer."
MASSAG_SOCCER_AUDIENCE_NPC,"I heard soccer is popular in your world and you were good at it!
I’d like to see if that's true.
Go for at least 9 goals!","Ouvi falar que futebol é muito popular no teu mundo e eras bom nisso!
Gostava de ver se é verdade.
Chega até pelo menos 9 golos!"
HERRKO_LORE_ANCESTOR_T,"The people of Herrko never question their origins, let alone the past.
Not many remember their true ancestors past a certain number of generations.
Our lineage goes much further than we could ever understand.
Some of us can only know that those before us were more powerfull
and almost unrecognizeable to an Yevlen of the present day.
Perhaps it is best to let the past stay hidden as Dirlindu can
only tell us some stories of those before us.","A sociedade de Herrko nunca questiona as suas origens, muito menos o passado.
Poucos se lembram dos seus verdadeiros antepassados após um certo número de gerações.
A nossa linhagem vai além do que jamais poderíamos entender.
Alguns de nós só podemos saber que aqueles que nos precederam foram mais poderosos
e quase irreconhecíveis para um Yevlen do presente.
Talvez seja melhor deixar o passado escondido, enquanto Dirlindu pode
contar-nos apenas algumas histórias daqueles que nos precederam."
NORTUBEL_WEIRD_TIME_LORE_T,"From Shelly's studies:
It seems time in these places functions in a rather ""elastic"" manner.
If one were to spend even up to 100 years in this place, they would retain
the same physical age they had when they first entered this world.
And if they return to their natural world, time there would be the same
as it was when they left.
It is less like the phenomenon of time dilation in regards to space and
more like as if your life span is being increased.
Some could see this as a benefit, but I believe there could be side effects.
Perhaps an obivous one could be insanity, if simply because humans are not meant
to live that long.
If one makes enough memories in a rather ""frozen"" age, that can drive someone mad.","Dos estudos da Shelly:
Parece que o tempo nestes lugares funciona de uma maneira “elástica”.
Se alguém passar até 100 anos neste lugar, manteria
a mesma idade física que tinham quando entrou neste mundo.
E se essa pessoa voltar ao seu mundo natural, o tempo seria 
o mesmo como era quando ela partiu.
É menos parecido com o fenómeno da dilatação do tempo no espaço e 
mais como se a expectativa de vida estivesse aumentando.
Alguns podem ver isto como um beneficio, mas acredito que pode haver efeitos secundários.
Talvez um óbvio pode ser loucura, simplesmente porque os humanos não foram feitos para 
viver assim tanto tempo.
Se alguém criar memórias suficientes numa idade “congelada”, isso pode enlouquecer alguém."
NORTUBEL_SEESAW_HANDCAR_T,"S: The handcar moves
R: The handcar stops.
It takes 2 people.","S: O carrinho de mão anda.
R: O carrinho de mão para.
Precisa de 2 pessoas."
MASSAG_ATLANTIS_LORE_T,"Atlantis is believed to be one of the first cities built in the world.
It is possible that every species in this world evolved from
single cell organisms that originate from water.
Though these 2 facts aren't necessarily related.
Aquatic species managed to evolve faster and build a civilization
while other species were more likely involved in wars and natural disasters.
Massag-Coav is at least 932 years old.","Acredita-se que Atlantis foi uma das primeiras cidades construídas no mundo.
É possível que todas as espécies do mundo evoluíram a partir de
organismos unicelulares que se originaram da água.
Embora esses dois factos não sejam necessariamente relacionados.
Espécies aquáticas conseguiram evoluir mais rápido e construir uma civilização
enquanto outras espécies foram mais envolvidas em guerras e desastres naturais.
Massag-Coav tem pelo menos 932 anos."
MASSAG_ELEGANT_LORE_T,"Elegantissia was built 650 years ago.
It is believed this city was built based on an argeement
in which avian species build their own civilization and culture.
But the more likely reason has to do with the planet's population
rising and worries about extinction.
As of today, it is believed 991.000 species have become extinct.","Elegantissia foi construída há 650 anos.
Acredita-se que esta cidade foi construída baseada num acordo
em que as espécies aviárias constroem a sua própria civilização e cultura.
Mas a razão mais provável tem a ver com a população do planeta
aumentando e preocupações com a extinção.
Até hoje, acredita-se que 991.000 espécies tenham sido extintas."
CUTSCENE_7_TALK_1,We're getting close!,Estamos quase a chegar!
CUTSCENE_7_TALK_2,"Feels weird that we took the lives of others, even if they were bad people.","Sinto estranha que tiramos as vidas de alguém, mesmo se foram homens maus."
CUTSCENE_7_TALK_3,"Well, I felt the same way. Even I still feel weird about it.","Eu também senti o mesmo. Até agora, sinto isso."
CUTSCENE_7_TALK_4,"Booker, are you alright?","Booker, você está bem?"
