id,en,pt
LAHIURN_LORE_TEXT_LADY_POSTER,"These posters were used to recruit men for Lahiurn's army.
Though as the war progressed, the country established rules and standards that would ban such imagery.
Therefore making these posters a product of the past.","Estes cartazes foram utilizados para recrutar homens para o exército de Lahiurn.
Mas enquanto a guerra avançou, o país estabeleceu regras e normas que proibiriam estas imagens.
Portanto, tornando estes cartazes um produto do passado."
LAHIURN_LORE_TEXT_NIGHT_RIDER,"The ""Night Rider"" is Lahiurn's first attempt at a super soldier.
Built using the latest technology and remains of prisoners, it has at least two methods of combat.
The first involves the use of a ""morning star"" that replaces one of its hands.
The second involves the entity to stomp the floor and create waves of electricity.","O ""Cavaleiro da Noite"" é a primeira tentativa de Lahiurn, de um super soldado.
Construído com a tecnologia mais avançada e restos de prisioneiros, possui pelo menos dois métodos de combate.
O primeiro incluí o uso de uma “estrela da manhã” que substitui uma das suas mãos.
O segundo incluí o sujeito  pisar o chão e criar ondas de eletricidade."
LAHIURN_LORE_TEXT_LAB_CHAIR,"Staphen Lomeshtin demands that his throne would be weaponized.
So far, two types of weaponry are included.
We've yet to test this throne since we're missing an important component: A battery.","Staphen Lomeshtin exige que o seu trono seja armado.
Por agora, incluímos dois tipos de armamento.
Ainda não testámos este trono porque falta um componente importante: Uma bateria."
LAHIURN_TEXT_MOUNTED_GUN_INFO,Press S to activate the weapon.,Prime S para ativar a arma.
LAHIURN_TEXT_ROPE_KNIFE_LEVEL_THREE,Cut the ropes with your knife.,Corta as cordas com a tua faca.
CUTSCENE_19_TALK_1,"Help, somebody!","Socorro, ajudem-nos!"
CUTSCENE_19_TALK_2,WHY IS THIS HAPPENING?,PORQUE É QUE ISTO ESTÁ A ACONTECER?
CUTSCENE_19_TALK_3,"Now, for a special trick...","Agora, um truque especial..."
CUTSCENE_19_TALK_4,There's a way out!,Ai está uma saída!
CUTSCENE_19_TALK_5,"Thank you, sir!
How did you do that?","Obrigado, senhor!
Como é que fez aquilo?"
CUTSCENE_19_TALK_6,"Well, a magician doesn't usually reveal his secrets.","Bem, um mágico normalmente não revela os seus segredos."
CUTSCENE_19_TALK_7,"Bonka, what happened? I thought you wouldn't reach this low!","Bonka, o que aconteceu? Eu nunca achei que tu ias descer para este nível!"
CUTSCENE_19_TALK_8,"Odin, I can explain. This wasn't part of my plan.","Odin, eu posso explicar. Isto não era parte do meu plano."
CUTSCENE_19_TALK_9,"BONKY, WHERE HAVE YOU BEEN, YOU IDIOT?
DON'T TELL ME YOU SLEPT WHEN I TOLD YOU TO LOOK AFTER THINGS WHILE I WAS GONE!","BONKY, ONDE É QUE FOSTE, SEU IDIOTA?
NÃO ME DIGAS QUE ADORMECESTE DEPOIS DE TE DIZER PARA VIGIAR AS COISAS, QUANDO EU SAÍ!"
CUTSCENE_19_TALK_10,"... uuhh... oi, ya know how easy it is for me to get sleepy and-","... uuhh... oi, tu sabes como eu fico com sono tão facilmente e-"
CUTSCENE_19_TALK_11,Puff? You're still working for her? Don't you have anything better to do?,Puff? Ainda estás a trabalhar com ela? Não tens coisas mais interessantes para fazer?
CUTSCENE_19_TALK_12,"Listen, all I wanted to do was humiliate you. I didn't mean to actually hurt you-","Ouvem, eu só queria gozar convosco. Eu não queria magoar ninguém-"
CUTSCENE_19_TALK_13,"THAT'S IT! WE'RE DONE HERE!
EVERYONE, LET'S GO!","JÁ CHEGA! ACABOU!
PESSOAL, VAMOS EMBORA!"
CUTSCENE_19_TALK_14,"WAIT, I almost forgot! I did see someone show up in the construction.
Thought it was Bonka but she was.. bald and looked a bit scary...","ESPEREM, quase esquecia! Eu VI alguém que apareceu na construção.
Pensava que era a Bonka mas... careca e um bocado assustadora..."
CUTSCENE_19_TALK_15,"And I saw 2 kids with her, they looked like Monica and illou...
But Monica had a pointy tooth and illou was dressed like a scientist.","E vi 2 crianças com ela, que pareciam a Monica e o illou...
Mas a Monica tinha um dente pontiagudo e o illou estava vestido como um cientista."
CUTSCENE_19_TALK_16,"You mean, like versions of Bonka and those 2 kids from a different universe?
Because we also stumbled upon our own doubles.
Carrie, do you think-","Estás a falar de versões da Bonka e essas 2 crianças de um universo diferente?
Porque nós também nos encontramos os nossos duplos.
Carrie, será que-"
CUTSCENE_19_TALK_17,"I don't care, I just wanna leave this place.","Estou me nas tintas, eu só quero é sair deste lugar."
CUTSCENE_19_TALK_18,You gotta believe me... ,Têm que acreditar em mim...
CUTSCENE_19_TALK_19,Bonka... we have to go....,Bonka... temos que ir embora...
CUTSCENE_19_TALK_20,"Don't worry Bonka, I believe you.","Não te preocupes, Bonka.
Eu acredito em ti."
CUTSCENE_19_TALK_21,"Honestly, I believe you too.
After all, I believe that beneath a trouble maker like you, there's someone that could need some help.
But duty is calling me, so I gotta go.","Sinceramente, eu também acredito em ti.
Acredito que, por trás de uma rapariga marota como tu, existe alguém que pode precisar de ajuda.
Mas o dever está a chamar-me, por isso tenho que ir."
CUTSCENE_19_TALK_22,"Grrr Odin, you cheesy, pretentious, annoying...","Grrr Odin, seu foleiro, pretensioso, irritante..."
CUTSCENE_19_TALK_23,"Big, strong, charming...","Grande, forte, charmoso..."
CUTSCENE_19_TALK_24,"Bonka, you alright?","Bonka, estás bem?"
CUTSCENE_19_TALK_25,"Well, there goes our plan. Nobody died and we were noticed.",Lá se vai o nosso plano. Ninguém morreu e fomos vistos.
CUTSCENE_19_TALK_26,Well at least we were only seen by that stupid bunny.,Pelo menos foi só aquele coelho estúpido que nos viu.
CUTSCENE_19_TALK_27,"But even the magician superhero believes her and if he believes it, more people will be aware.
We better do something about it.","Mas até o super mágico acredita nela e por isso, mais pessoas podem acreditar.
Temos que fazer algo."
CUTSCENE_19_TALK_28,"I'm tired of being in the shadows.
Maybe I should face Bonka face to face and turn her world upside down.","Estou farta de estar nas sombras.
Talvez vou confrontar a Bonka cara a cara e virar o mundo dela ao contrário."
CUTSCENE_19_TALK_29,Yeah. More fun that way.,Yeah. Tem mais piada assim.
CUTSCENE_19_TALK_30,"Um, what are you guys talking about? I didn't see anything.","Um, do que é que vocês estão a falar? Eu não vi nada."
CUTSCENE_19_TALK_31,"Look at that old lady, is she lost?
Excuse me, but who are you, miss?","Será que aquela senhora está perdida?
Desculpe mas quem é você?"
CUTSCENE_19_TALK_32,My name is Claudia Santamara. I deliver presents to those who are well behaved.,O meu nome é Claudia Santamara. Eu trago presentes para aqueles que se portem bem.
CUTSCENE_19_TALK_33,"I've been travelling through different worlds ever since I've left Brinkaedea, which unfortunately was destroyed.","Viajem por mundos diferentes desde que vim do mundo de Brinkaedea, que infelizmente foi destruído."
CUTSCENE_19_TALK_34,"But we've left Brinkaedea a short while ago.
And we've had to put up with an annoying clown girl named Bonka.","Mas nós acabamos de sair de Brinkaedea a pouco tempo.
E tivemos que aturar uma rapariga palhaço irritante chamada Bonka."
CUTSCENE_19_TALK_35,"I don't know who ""Bonka"" is, but I've met a girl named Bonkette and she is so much trouble.
Perhaps, there is another Brinkaedea I've never heard of.","Eu nunca ouvi falar dessa ""Bonka"", mas conheci uma rapariga chamada Bonkette e ela é muito perigosa.
Talvez existe outra Brinkaedea que nunca ouvi falar."
CUTSCENE_19_TALK_36,Maybe Bonka is right...,Talvez a Bonka tem razão...
CUTSCENE_19_TALK_37,"Either way, I'm curious about this world.
Are you from here?","De qualquer modo, estou curiosa por este mundo.
Vocês serão daqui?"
CUTSCENE_19_TALK_38,"It reminds us of our home but not really.
We're trying to find a way home, actually.","Faz-nos lembrar a nossa casa mas não exatamente.
Estamos a tentar encontrar uma saída."
CUTSCENE_20_TALK_1,"Hey look, it's that fish guy from that place with the talking animals.","Olhem, é aquele homem peixe daquele sitio com os animais que falam."
CUTSCENE_20_TALK_2,"Is he lost?
Should we help him?","Será que ele está perdido?
Não devíamos ajuda-lo?"
CUTSCENE_20_TALK_3,"You all behaved nicely, I believe I owe you some presents.","Vocês portaram-se todos bem, por isso acho que vos devo alguns presentes."
CUTSCENE_20_TALK_4,"Thank you mam, but the only thing we need is a way back home.","Obrigado minha senhora, mas a única coisa que nós precisamos é um caminho para casa."
CUTSCENE_20_TALK_5,"I see. In fact, I am correct that I owe you all something.","Estou a ver. Ainda assim, tinha razão que vos devo algo."
CUTSCENE_20_TALK_6,Now I must go. Perhaps we may meet again.,Agora tenho que ir. Talvez nos voltamos a ver.
CUTSCENE_20_TALK_7,This piece fits one of these holes.,Esta peça cabe num dos buracos.
CUTSCENE_20_TALK_8,"Everyone, hide!
Those planes could drop something.","Pessoal, escondem!
Aqueles aviões podem largar algo."
CUTSCENE_20_TALK_9,What are these men talking about?,Do que é que estes homens estão a falar?
CUTSCENE_20_TALK_10,You know the way out?,Conheces uma saída?
CUTSCENE_20_TALK_11,We can just keep going North and we'll find the sub base. There has to be some submarines left.,Podemos continuar para norte e encontraremos a base dos submarinos. Ainda pode haver alguns.
CUTSCENE_20_TALK_12,But we must be carefull. I heard they're using a recent prototype of a weapon in this war.,Mas temos que ter cuidado. Ouvi falar que eles estão a usar um protótipo recente duma arma nesta guerra.
CUTSCENE_20_TALK_13,What kind of weapon?,Que tipo de arma?
CUTSCENE_20_TALK_14,"They were experimenting with bodies of prisoners and turning them into machines.
As if they were creating blind followers out of corpses.","Eles experimentaram com corpos de prisioneiros e transforma-los em maquinas.
Como se eles estivessem a criar seguidores com pedaços de mortos."
DIRK_ADVENTURER_NPC_TALK,"It appears I've been caught. I shall improve upon my stealth skills.
But to be caught by a beautiful maiden, of such colorfull hair and a nice dress... and delightful skin.
It is a great honor. Perhaps an outsider, like myself, on this strange world.","Parece que fui apanhado. Tenho que melhorar as minhas habilidades de escondimento .
Mas ser apanhado por uma donzela linda, de cabelos tão coloridos e um vestido lindo... e pele maravilhosa.
É uma grande honra. Talvez será de fora, como eu, neste mundo estranho."
BATTY_VAMPS_NPC_TALK_NO_VICTORY,"No foolish mortal could ever beat this game.
What makes you think you'll be an exception?","Nenhum mortal tolo poderia vencer este jogo.
Porque é que tu pensas que serás uma exceção?"
BATTY_VAMPS_NPC_TALK_YES_VICTORY,"You did?
Anyway, not a huge fan of this place anyway.
Did those 2 got all the blood before I did?","Conseguiste?
De qualquer forma, não sou grande fã deste lugar.
Será que aqueles 2 ficaram com todo o sangue?"
UNTOTERN_TEXT_BAT_GAME,"S: Start the game and make the bat fly down.
R: Make the bat fly up.","S: Começar o jogo e voar para baixo.
R: Voar para cima."
HERRKO_LORE_TEXT_REGAHUUKA,"Current year: 1509
Centuries ago, it is believed a group of beings created the planet Regahuuka and shaped the world 
in a matter of weeks.
The planet has an oval shape and some believe the world might end if a new great being is born.
Others believe the being has died long ago.


The moon that floats alongside Regahuuka is believed to be a castle, where our creators might've come from.
But those who tried leaving the planet could never return alive, nor could they reach that far.","Ano atual: 1509
Há séculos atrás, acredita-se que um grupo de seres criou o planeta Regahuuka e moldou 
o mundo em semanas.
O planeta tem uma forma oval e há quem acredite que o mundo poderá acabar 
se nascer um novo grande ser.
Outros acreditam que o ser morreu há muito tempo.


Acredita-se que a lua que flutua junto a Regahuuka é um castelo, 
de onde os nossos criadores podem ter vindo.
Mas aqueles que tentaram sair do planeta nunca conseguiram regressar vivos, 
nem conseguiram chegar tão longe."
HERRKO_LORE_TEXT_GHALBEEN,"Ghalbeens use their long arms to swing from trees and vines, 
and also to climb on trees.
They managed to build their own cities on large trees while 
using their acrobatic skills.
Even female Ghalbeens are known for their acrobatics despite their, 
occasionally described as ""stacked"" proportions.","Os Ghalbeens usam os seus longos braços para 
se balançarem em árvores e vinhas,
e também para subir às árvores.
Conseguiram construir as suas próprias cidades em grandes árvores enquanto
usando as suas habilidades acrobáticas.
Até as mulheres Ghalbeens são conhecidas pelas suas acrobacias, apesar
das suas proporções, as vezes descritas como ""carregadas""."
HERRKO_LORE_TEXT_HORG,"Is it said an Horg's skin can resist sharp blades.
Because of this, they can climb these swords on the cliff with no trouble.
Though despite this, their skin is not as hard as it sounds.
A female Horg's skin can be very smooth.","Diz-se que a pele de um Horg pode resistir lâminas afiadas.
Por causa disso, podem escalar estas espadas no penhasco sem problemas.
Apesar disso, a sua pele não é tão dura como parece.
A pele de uma mulher Horg pode ser bastante macia."
HERRKO_LORE_TEXT_EULORIA,"Euloria's birth is declared to be a miracle.
During a war, her parents and some guards escaped from a burning ship, through a small boat.
At midnight, her mother successfully gave birth to the princess of Herrko.","O nascimento de Euloria é considerado um milagre.
Durante uma guerra, os seus pais e alguns guardas escaparam de um navio em chamas, 
através de um barco pequeno.
À meia-noite, a sua mãe deu à luz a princesa de Herrko, com sucesso."
HERRKO_LORE_TEXT_TURRET_RING,"These rings are part of Herrko's defense system.
During conflicts, wizards use these rings to create projectiles of energy 
which are then shot at invaders.
Whoever, the most sophisticated and impressive example 
of Herrko's defense system is the use of lava.
In which cities and establishments are closed and protected 
with great iron walls, to allow the lava to flow easily
and only hurting ideal targets and invaders.","Estes anéis fazem parte do sistema de defesa de Herrko.
Durante alguns conflitos, feiticeiros usam estes anéis 
para criar projéteis de energia
que são depois disparados contra invasores.
Mesmo assim, o exemplo mais sofisticado e impressionante
do sistema de defesa de Herrko é a utilização de lava.
Em que as cidades e estabelecimentos serão fechados e protegidos
com grandes paredes de ferro, para permitir que a lava flua facilmente, 
apenas ferindo alvos e invasores ideais."
HERRKO_LORE_TEXT_UULGA_TUTORIAL,"A + Right: Uulga follows you.
A + Left: Uulga runs away from you.
A + Down: Uulga stops.
X: Uulga jumps.

If Uulga gets near an enemy, she will attack.
Uulga can also break some walls that get in the way.
Uulga is strong enough that she doesn't need to heal.
Unfortunately, Uulga is a bit tall meaning you two
have to help her on that regard.","A + Direita: Uulga segue-te.
A + Esquerda: Uulga foge de ti.
A + Baixo: Uulga para.
X: Uulga salta.

A Uulga ataca inimigos se estiver perto suficiente.
Uulga também pode quebrar algumas paredes em frente.
Uulga é forte o suficiente para não precisar de ser curada.
Infelizmente, Uulga é um pouco alta, o que significa que vocês
os dois têm que ajudá-la nesse aspeto."
UULGA_NPC_TALK_NO_ITEM,"Can't believe this happened! Hey, can you help me?
I forgot my towel. Would you mind searching it for me?
It's a simple white towel. I might've left somewhere close.","Não acredito que isto aconteceu! Hey, podes ajudar-me?
Esqueci da minha toalha. Importas-te de a procurar?
É uma toalha branca simples. Talvez estará por ai, algures perto."
UULGA_NPC_TALK_YES_ITEM,"Thank you.
This place's getting colder.
Wonder how Pebble is going.","Obrigada.
Este sitio está a ficar frio.
Como está a Pebble?"
UULGA_NPC_HUG,"You seem very polite.
Perhaps you're full of admiration.
You may never reach a figure like mine but I can train you.","És muito bem educada.
Talvez estejas cheia de admiração.
Nunca chegarás ao mesmo nível duma figura como a minha, mas eu posso te treinar."
UULGA_NPC_HURT,What a useless blade you got there.,Que lamina inútil que tens ai.
UULGA_NPC_HONK,"You should restrain your passion.
And besides, I don't even know you.","Devias restringir a tua paixão.
E além disso, nem sequer te conheço."
PEBBLE_NPC_TALK,"Welcome to our village.
Don't mind the way how things are built here.
We've had bigger visitors around here but you can tell this place was built 
for a species like ours.","Bem-vindos à nossa aldeia.
Não se preocupem da maneira de como as coisas são construídas aqui.
Tivemos visitantes maiores, mas dá para perceber que este sitio 
foi construído para uma espécie como a nossa."
PEBBLE_NPC_HUG,"Wanna a hug too? Don't mind my long arms.
If you want to pick me up, don't worry about my weight too.
Our kind can be quite resistant to gravity.","Queres um abraço também? Não te preocupes com os meus braços longos.
Se quiseres me pegar, não te preocupes também com o meu peso.
A nossa espécie pode ser bastante resistente à gravidade."
PEBBLE_NPC_HURT,"Hey, what's wrong with you?
Got any strange voices in your head or something?","Hey, o que é que se passa contigo?
Tens algumas vozes estranhas na tua cabeça ou quê?"
IVAN_NPC_TALK,"I still want to know.
Are both of you princesses from a realm I haven't heard of?","Ainda gostava de saber.
Vocês as duas são princesas de um reino, que eu ainda não ouvi falar?"
IVAN_NPC_HURT,"You're not fit to fight, I can tell.","Não és apta para combate, isso sei dizer."
IVAN_NPC_HUG,"I appreciate the gesture but...
Does that friend of yours mind?","Agradeço o gesto, mas...
Aquele amigo teu, será que ele importa?"
IVAN_NPC_HONK,Doesn't seem quite a generous gesture from someone like you.,Não parece um gesto honroso vindo de alguém como você.
LARGE_TARRAK_NPC_NAME,Large Tarrak,Tarrak enorme
EULORIA_NPC_TALK,"Who are you?
How did you get there and why?","Quem é você?
Como é que entrou e porquê?"
EULORIA_NPC_HURT,Do not dare to start a war you cannot win.,Não se atreva começar uma guerra que não poderá vencer.
EULORIA_NPC_HUG,"If you're a prince proposing your hand in marriage, I decline.
I don't even know what species you are from.","Se é um príncipe a propor a mão em casamento, recuso.
Nem sei de que espécie é."
EULORIA_NPC_HONK,"How could you?
I'm the princess of Herrko, you swine.","Como se atreve?
Eu sou a princesa de Herrko, seu suíno."
CONVO_PEBBLE_UULGA_1,"I just caught my uncle from eating another book.
This time, a useful culinary one.","Acabei de apanhar o meu tio a comer outro livro.
Desta vez, um de culinária que era útil."
CONVO_PEBBLE_UULGA_2,"Again?
I thought Ghalbeens stopped doing that years ago.","Outra vez?
Pensei que os Ghalbeens deixaram de fazer isso há anos."
CONVO_PEBBLE_UULGA_3,"And worst of all is, I work at the library there.
At least I remember some good recipes.","E o pior de tudo é que eu trabalho na biblioteca local.
Pelo menos lembro-me de algumas receitas boas."
CONVO_PEBBLE_UULGA_4,"Maybe we could write a culinary book together.
I know of some good recipes too.","Talvez podemos escrever um livro de culinária juntas.
Também conheço algumas boas receitas."
PRESCILLIA_NPC_TALK,I'd like to marry an Horg man... and I wouldn't mind an Horg lady too.,Gostava de casar com um homem Horg... e também não importava uma senhora Horg.
PINTO_NPC_TALK,"Oh no, it seems some Ghalbeens have been corrupted by Lakk.
Be careful, their arrows can follow you even if you run.","Oh, não, parece que alguns Ghalbeens foram corrompidos por Lakk.
Tem cuidado, as flechas deles podem seguir-te mesmo que corres."
GALAGHAR_NPC_TALK,"Some Horgs were not spared by the curse of Lakk.
Their hammers can summon shockwaves, which can paralyze you with such vibrations.
Even if these don't hurt you on their own, you'll still be left vulnerable to other dangers.","Alguns Horgs não foram poupados pela maldição de Lakk.
Os seus martelos podem invocar ondas de choque, que podem paralisar-vos com tais vibrações.
Mesmo se as ondas próprias não sejam dolorosas, continuaram vulneráveis a outros perigos."
HERRKO_GUARD_NPC_TALK,"I still have nightmares about Lakk.
One great warrior had his soul taken over by Lakk and the first thing
he did was slaughter his own family.","Ainda tenho pesadelos com o Lakk.
Houve um grande guerreiro que teve a sua alma dominada por Lakk 
e a primeira coisa que fez foi massacrar a sua própria família."
HERRKO_GUARD_NPC_NAME,Herrko guard,Guarda de Herrko
DIRLINDU_NPC_TALK,"I know what you seek.
Your curiosity is helping you in ways you've yet to realize.","Eu sei o que procura.
A sua curiosidade está a ajudá-lo de maneiras que ainda não percebeu."
DIRLINDU_NPC_HUG,"This action speaks something.
Your past is troubled and soon, you may no longer keep running from it.","Essa ação diz alguma coisa.
O seu passado é perturbado e em breve, não poderá continuar a fugir dele."
DIRLINDU_NPC_HURT,"If you fear something, there are better ways to face your fears.","Se tem medo de alguma coisa, existem melhores formas de enfrentar os seus medos."
NAMYLEA_NPC_TALK,"I love exploring new places.
Perhaps this one will be full of surprises.","Adoro explorar novos lugares.
Talvez este esteja cheio de surpresas."
NAMYLEA_NPC_HUG,"Watch out for my suit.
Hope it doesn't make it uncomfortable.","Cuidado com o meu fato.
Espero que não seja desconfortável."
NAMYLEA_NPC_HONK,"What are you doing?
Are you looking for something?","O que estás a fazer?
Estás á procura de alguma coisa?"
NAMYLEA_NPC_HURT,"Hey, watch it!
What's gotten into your head?","Hey, cuidado!
O que te deu na cabeça?"
NAMYLEA_WITHOUT_ARMOR_NPC_TALK,"Don't worry about me, I'll heal.
Focus on protecting those other dolls.
Your lives are in danger!","Não se preocupem comigo, eu ficarei bem.
Preocupem-se com a proteção desses bonecos.
As vossas vidas estão em perigos!"
CONVO_NAMYLEA_KATRIN_1,"Miss Namylea, how do you feel about the war going on in your world?","Senhora Namylea, como é que você se sente sobre a guerra no seu mundo?"
CONVO_NAMYLEA_KATRIN_2,"It's terrible. At least my country has yet to be involved.
But I know my sister has already been enlisted to the military.","É terrível. Pelo menos o meu país ainda não esteve envolvido.
Mas sei que a minha irmã já foi alistada no exército."
CONVO_NAMYLEA_KATRIN_3,Is she still alive?,Ainda está viva?
CONVO_NAMYLEA_KATRIN_4,"Yes. Her name is Sabrina.
From what I heard, she's just organizing packages and helping with transport.
But she already has combat experience beforehand.","Sim. O nome dela é Sabrina.
Pelo que ouvi, ela está apenas a organizar pacotes e a ajudar no transporte.
Mas ela já tinha experiência de combate."
CONVO_NAMYLEA_CARRIE_1,"Miss Matdur, have you ever seen any strange animals underwater?","Senhora Matdur, alguma vez viu algum animal estranho debaixo de água?"
CONVO_NAMYLEA_CARRIE_2,"Yes, I've seen large squids and octopuses!
It's amazing the kind of biodiversity that resides deep in the oceans.","Sim, já vi lulas e polvos enormes!
É incrível a biodiversidade que reside nas profundezas dos oceanos."
CONVO_NAMYLEA_CARRIE_3,"Cool. I always wanted to look into aquatic life forms myself.
But I kinda gave up on that. Don't think I'll get the chance to make that happen.","Fixe. Sempre quis investir na área de seres aquáticos.
Mas eu desisti um pouco nisso.
Não acho que terei a hipótese de fazer isso acontecer."
CONVO_NAMYLEA_CARRIE_4,"Never give up on a dream.
You're still young and you must have your life ahead of you.
I've known people that realized their dreams at their 50's and they're still alive.","Nunca desistes de um sonho.
Ainda és jovem e deves ter uma vida pela frente.
Conheço pessoas que realizaram os seus sonhos aos 50 anos e ainda estão vivas."
CUTSCENE_21_TALK_1,Are we getting somewhere?,Estamos a chegar a algum lado?
CUTSCENE_21_TALK_2,I see some light. We just gotta keep going!,Vejo alguma luz. Só precisamos de continuar!
CUTSCENE_21_TALK_3,"Freeze, now! Who are you?",Pare imediatamente! Quem é você?
CUTSCENE_21_TALK_4,"Wait, we can explain!","Esperem, deixem-me explicar!"
CUTSCENE_21_TALK_5,Let's get this over with: Who do you work for? And what orders did they give you?,Vamos voltar ao assunto: A quem vocês trabalham? E quais foram as suas ordens?
CUTSCENE_21_TALK_6,"Nobody, we're just looking for our way home.
We're not even from this universe.","Ninguém, só queremos voltar para casa.
Nem somos deste universo."
BUELLAROCK_SOLDIER_NAME,Buellarock Soldier,Soldado de Buellarock
CUTSCENE_21_TALK_7,"Sir, we examined some of their contents but found no clue of any ties to either Lahiurn or Eygzouhl.","Senhor, acabámos de analisar os conteúdos mas não encontra-mos nenhuma relação com Lahiurn ou Eygzouhl."
CUTSCENE_21_TALK_8,"What country are they from?
Any document in any language someone might recognize?","De que pais vieram?
Algum documento em qualquer língua que alguém reconhece?"
CUTSCENE_21_TALK_9,"We found some books in this weird language.
I thought I recognized the language but they don't seem to be from Dahrgrinde.","Encontramos livros com uma língua estranha.
Pensava que poderia reconhece-la mas eles não parecem de ser de Dahrgrinde."
CUTSCENE_21_TALK_10,"Maybe the... ""blue"" girl has something to say.
What kinda God made you kids?","Talvez a miúda... ""azul"" tem algo a dizer.
Mas que raio de deus vos criou?"
